{
  "agents_included": [
    "claude",
    "codex",
    "gemini",
    "cursor",
    "hermes"
  ],
  "chorus_output_version": 1,
  "cwd": "/workspace/demo",
  "timeline": [
    {
      "agent": "claude",
      "cwd": "/workspace/demo",
      "session_id": "session-claude-fixture-0001",
      "snippet": "Claude fixture assistant output.",
      "timestamp": "__TS__"
    },
    {
      "agent": "claude",
      "cwd": "/workspace/demo",
      "session_id": "session-claude-no-assistant",
      "snippet": "Could not extract assistant messages. Showing last 20 raw lines:\n{\"cwd\":\"/workspace/demo\"}\n{\"type\":\"human\",\"message\":{\"role\":\"user\",\"content\":[{\"type\":\"text\",\"text\":\"User message only, no assistant re",
      "timestamp": "__TS__"
    },
    {
      "agent": "claude",
      "cwd": "/workspace/demo",
      "session_id": "session-claude-redaction-stress",
      "snippet": "Here are some secrets: sk-[REDACTED] and AKIA[REDACTED] and Bearer [REDACTED] and api_key=[REDACTED] and token=[REDACTED] and password=[REDACTED] and apikey=[REDACTED] and secret=[REDACTED]",
      "timestamp": "__TS__"
    },
    {
      "agent": "claude",
      "cwd": "/workspace/demo",
      "session_id": "session-claude-tool-fixture",
      "snippet": "Checking the file.Done reading.",
      "timestamp": "__TS__"
    },
    {
      "agent": "codex",
      "cwd": "/workspace/demo",
      "session_id": "session-codex-fixture-0001",
      "snippet": "Codex fixture assistant output.",
      "timestamp": "__TS__"
    },
    {
      "agent": "codex",
      "cwd": "/workspace/demo",
      "session_id": "session-codex-malformed",
      "snippet": "Valid message after malformed line.",
      "timestamp": "__TS__"
    },
    {
      "agent": "codex",
      "cwd": "/workspace/demo",
      "session_id": "session-codex-mixed-schema",
      "snippet": "Third response_item message.",
      "timestamp": "__TS__"
    },
    {
      "agent": "codex",
      "cwd": "/workspace/demo",
      "session_id": "session-codex-multi",
      "snippet": "Third assistant response.",
      "timestamp": "__TS__"
    },
    {
      "agent": "codex",
      "cwd": "/workspace/demo",
      "session_id": "session-codex-tool-fixture",
      "snippet": "Running a shell command.Listed the directory.",
      "timestamp": "__TS__"
    },
    {
      "agent": "cursor",
      "cwd": "/workspace/demo",
      "session_id": "cursor-app-fixture-uuid",
      "snippet": "Second answer, with a [TOOL:Read] mark.",
      "timestamp": "__TS__"
    },
    {
      "agent": "cursor",
      "cwd": "/workspace/demo",
      "session_id": "cursor-app-redaction-uuid",
      "snippet": "Found token=[REDACTED] Also Bearer [REDACTED]",
      "timestamp": "__TS__"
    },
    {
      "agent": "cursor",
      "cwd": "/workspace/demo",
      "session_id": "session-cursor-fixture-0001",
      "snippet": "Cursor fixture assistant output.",
      "timestamp": "__TS__"
    },
    {
      "agent": "cursor",
      "cwd": "/workspace/demo",
      "session_id": "session-cursor-tool-calls",
      "snippet": "Checking the file.Done reading.",
      "timestamp": "__TS__"
    },
    {
      "agent": "gemini",
      "cwd": "demo",
      "session_id": "session-gemini-empty",
      "snippet": null,
      "timestamp": "__TS__"
    },
    {
      "agent": "gemini",
      "cwd": "demo",
      "session_id": "session-gemini-fixture-0001",
      "snippet": "Gemini fixture assistant output.",
      "timestamp": "__TS__"
    },
    {
      "agent": "gemini",
      "cwd": "demo",
      "session_id": "session-gemini-history-format",
      "snippet": "4",
      "timestamp": "__TS__"
    },
    {
      "agent": "gemini",
      "cwd": "demo",
      "session_id": "session-gemini-jsonl-fixture",
      "snippet": "Second jsonl assistant answer.",
      "timestamp": "__TS__"
    },
    {
      "agent": "hermes",
      "cwd": "/workspace/demo",
      "session_id": "session-hermes-fixture",
      "snippet": "Hermes fixture assistant output.",
      "timestamp": "__TS__"
    }
  ],
  "warnings": []
}
